{
  "schema_version": "1.0.0",
  "artifact_type": "scientific_review_version_diff",
  "generated_at": "2026-07-01T12:00:00Z",
  "from_release": {
    "review_id": "review-example",
    "release_id": "release-example-v1-0-0",
    "version": "1.0.0",
    "manifest_sha256": "1111111111111111111111111111111111111111111111111111111111111111",
    "frozen_at": "2026-06-01T12:00:00Z"
  },
  "to_release": {
    "review_id": "review-example",
    "release_id": "release-example-v1-1-0",
    "version": "1.1.0",
    "manifest_sha256": "2222222222222222222222222222222222222222222222222222222222222222",
    "frozen_at": "2026-07-01T12:00:00Z"
  },
  "immutable_inputs": {
    "from_snapshot_sha256": "f2094eb06f6f19c3a4bdf97bf8f149ba91d553d43d381037c7e1f476d81bbd1d",
    "to_snapshot_sha256": "bee7cab2f377cfb77bd4ad2ee7be37c4aad0348b043f653fdb3d7b2b401a4dc7",
    "from_trust_report_sha256": "dd4774365f89b220e6908233688bc1182662a6b3fbf9aae822a85b041db0ac41",
    "to_trust_report_sha256": "356aa8c1f63bf7792b98e909aa1691ee65940021d316c0c11479cd129904bb5c"
  },
  "methodology": {
    "trust_recomputed": false,
    "matching": "same claim_id, then explicit supersedes_claim_ids"
  },
  "summary": {
    "claims": {
      "added": 1,
      "removed": 1,
      "modified": 1,
      "unchanged": 1
    },
    "trust_overall_changed": 1,
    "trust_overall_added_or_removed": 2,
    "evidence_basis_changed": 1,
    "evidence_basis_added_or_removed": 2,
    "human_decision_references_added": 2,
    "orphaned_anchors": 1
  },
  "claims": [
    {
      "comparison_id": "clm_aaaaaaaaaaaaaaaa--clm_bbbbbbbbbbbbbbbb",
      "status": "modified",
      "before": {
        "claim_id": "clm_aaaaaaaaaaaaaaaa",
        "claim_text": "The intervention improves the measured outcome.",
        "citation_keys": [
          "SourceA"
        ],
        "evidence_basis": {
          "derived_evidence_relation": "directly_supported",
          "eligible_citations": [
            {
              "cite_key": "SourceA",
              "doi": "10.1000/source-a",
              "supports_claim_atoms": [
                "a1"
              ]
            }
          ],
          "atom_support": {
            "a1": [
              "SourceA"
            ]
          }
        },
        "trust": {
          "rubric_version": "2.0.0",
          "report_sha256": "dd4774365f89b220e6908233688bc1182662a6b3fbf9aae822a85b041db0ac41",
          "component_scores": {
            "traceability": 4,
            "robustness": 2,
            "uncertainty_calibration": 4,
            "source_integrity": 3,
            "transferability_scope_control": 3
          },
          "overall_score": 80,
          "trust_label": "moderate_trust"
        },
        "human_decision_references": [
          "decision-example-0001"
        ]
      },
      "after": {
        "claim_id": "clm_bbbbbbbbbbbbbbbb",
        "claim_text": "Across the sampled population, the intervention is associated with an improved measured outcome.",
        "citation_keys": [
          "SourceA",
          "SourceB"
        ],
        "evidence_basis": {
          "derived_evidence_relation": "directly_supported",
          "eligible_citations": [
            {
              "cite_key": "SourceA",
              "doi": "10.1000/source-a",
              "supports_claim_atoms": [
                "a1"
              ]
            },
            {
              "cite_key": "SourceB",
              "doi": "10.1000/source-b",
              "supports_claim_atoms": [
                "a1",
                "a2"
              ]
            }
          ],
          "atom_support": {
            "a1": [
              "SourceA",
              "SourceB"
            ],
            "a2": [
              "SourceB"
            ]
          }
        },
        "trust": {
          "rubric_version": "2.0.0",
          "report_sha256": "356aa8c1f63bf7792b98e909aa1691ee65940021d316c0c11479cd129904bb5c",
          "component_scores": {
            "traceability": 4,
            "robustness": 4,
            "uncertainty_calibration": 4,
            "source_integrity": 4,
            "transferability_scope_control": 4
          },
          "overall_score": 100,
          "trust_label": "high_trust"
        },
        "human_decision_references": [
          "decision-example-0001",
          "decision-example-0003"
        ]
      },
      "changes": {
        "claim_text_changed": true,
        "citations": {
          "added": [
            "SourceB"
          ],
          "removed": []
        },
        "evidence_basis_changed": true,
        "trust": {
          "components": {
            "robustness": {
              "before": 2,
              "after": 4
            },
            "source_integrity": {
              "before": 3,
              "after": 4
            },
            "transferability_scope_control": {
              "before": 3,
              "after": 4
            }
          },
          "overall": {
            "before": 80,
            "after": 100
          },
          "label": {
            "before": "moderate_trust",
            "after": "high_trust"
          }
        },
        "human_decision_references": {
          "added": [
            "decision-example-0003"
          ],
          "removed": []
        }
      }
    },
    {
      "comparison_id": "clm_cccccccccccccccc--none",
      "status": "removed",
      "before": {
        "claim_id": "clm_cccccccccccccccc",
        "claim_text": "A preliminary subgroup pattern was observed.",
        "citation_keys": [
          "SourceC"
        ],
        "evidence_basis": {
          "derived_evidence_relation": "partially_supported",
          "eligible_citations": [
            {
              "cite_key": "SourceC",
              "doi": "10.1000/source-c",
              "supports_claim_atoms": [
                "a1"
              ]
            }
          ],
          "atom_support": {
            "a1": [
              "SourceC"
            ]
          }
        },
        "trust": {
          "rubric_version": "2.0.0",
          "report_sha256": "dd4774365f89b220e6908233688bc1182662a6b3fbf9aae822a85b041db0ac41",
          "component_scores": {
            "traceability": 3,
            "robustness": 1,
            "uncertainty_calibration": 3,
            "source_integrity": 3,
            "transferability_scope_control": 2
          },
          "overall_score": 60,
          "trust_label": "low_trust"
        },
        "human_decision_references": [
          "decision-example-0002"
        ]
      },
      "after": null,
      "changes": {
        "claim_text_changed": true,
        "citations": {
          "added": [],
          "removed": [
            "SourceC"
          ]
        },
        "evidence_basis_changed": true,
        "trust": {
          "components": {
            "traceability": {
              "before": 3,
              "after": null
            },
            "robustness": {
              "before": 1,
              "after": null
            },
            "uncertainty_calibration": {
              "before": 3,
              "after": null
            },
            "source_integrity": {
              "before": 3,
              "after": null
            },
            "transferability_scope_control": {
              "before": 2,
              "after": null
            }
          },
          "overall": {
            "before": 60,
            "after": null
          },
          "label": {
            "before": "low_trust",
            "after": null
          }
        },
        "human_decision_references": {
          "added": [],
          "removed": [
            "decision-example-0002"
          ]
        }
      }
    },
    {
      "comparison_id": "clm_eeeeeeeeeeeeeeee--clm_eeeeeeeeeeeeeeee",
      "status": "unchanged",
      "before": {
        "claim_id": "clm_eeeeeeeeeeeeeeee",
        "claim_text": "The comparator protocol remained unchanged.",
        "citation_keys": [
          "ProtocolE"
        ],
        "evidence_basis": {
          "derived_evidence_relation": "directly_supported",
          "eligible_citations": [
            {
              "cite_key": "ProtocolE",
              "doi": "10.1000/protocol-e",
              "supports_claim_atoms": [
                "a1"
              ]
            }
          ],
          "atom_support": {
            "a1": [
              "ProtocolE"
            ]
          }
        },
        "trust": {
          "rubric_version": "2.0.0",
          "report_sha256": "dd4774365f89b220e6908233688bc1182662a6b3fbf9aae822a85b041db0ac41",
          "component_scores": {
            "traceability": 4,
            "robustness": 4,
            "uncertainty_calibration": 4,
            "source_integrity": 4,
            "transferability_scope_control": 4
          },
          "overall_score": 100,
          "trust_label": "high_trust"
        },
        "human_decision_references": []
      },
      "after": {
        "claim_id": "clm_eeeeeeeeeeeeeeee",
        "claim_text": "The comparator protocol remained unchanged.",
        "citation_keys": [
          "ProtocolE"
        ],
        "evidence_basis": {
          "derived_evidence_relation": "directly_supported",
          "eligible_citations": [
            {
              "cite_key": "ProtocolE",
              "doi": "10.1000/protocol-e",
              "supports_claim_atoms": [
                "a1"
              ]
            }
          ],
          "atom_support": {
            "a1": [
              "ProtocolE"
            ]
          }
        },
        "trust": {
          "rubric_version": "2.0.0",
          "report_sha256": "356aa8c1f63bf7792b98e909aa1691ee65940021d316c0c11479cd129904bb5c",
          "component_scores": {
            "traceability": 4,
            "robustness": 4,
            "uncertainty_calibration": 4,
            "source_integrity": 4,
            "transferability_scope_control": 4
          },